	en	fr	es	el	it	ar	de
forensic_tip	All forensic filters displayed below are aimed at detecting picture signal alteration such as incoherences in compression, frequencies, jpeg blocks, etc... More filters highlight some specific zone, more likely the image could be tampered. Note that alteration in the signal can be also triggered by light conditions, resampling or compressing the image without intention to alter its semantics. You can click on each filter to see it on top of the image you want to check. You can then use the vertical slider to compare the filter output with the initial picture.	Tous les filtres forensic présentés ci-dessous visent à détecter les altérations du signal dans l'image telles que les incohérences dans la compression, les fréquences, les blocs jpeg, etc. Plus les filtres mettent en évidence une zone spécifique, plus il est probable que l'image soit altérée. Notez que l'altération du signal peut également être déclenchée par des conditions de lumière, en rééchantillonnant ou en compressant l'image sans intention d'en altérer la sémantique. Vous pouvez cliquer sur chaque filtre pour le voir sur l'image que vous voulez vérifier. Vous pouvez alors utiliser le curseur vertical pour comparer la sortie du filtre avec l'image initiale.	Todos los filtros forensics que se muestran a continuación tienen como objetivo detectar una posible alteración de la señal de la imagen, como incoherencias en la compresión, frecuencias, bloques jpeg, etc... Cuando más filtros resaltan alguna zona específica, es más probable que la imagen pueda ser alterada. Obsérvese que la alteración de la señal también puede ser provocada por condiciones de luz, remuestreo o compresión de la imagen sin intención de alterar su semántica. Puede hacer clic en cada filtro para verlo encima de la imagen que quiere comprobar. Puede utilizar el control deslizante vertical para comparar la salida del filtro con la imagen inicial.	Όλα τα φίλτρα ανίχνευσης αυθεντικότητας που εμφανίζονται παρακάτω στοχεύουν στην ανίχνευση αλλαγής σήματος εικόνας, όπως ασυνέπειες στη συμπίεση, συχνότητες, μπλοκ jpeg, κ.λπ ...  Όσο περισσότερα φίλτρα επισημαίνουν κάποια συγκεκριμένη ζώνη, τόσο πιθανότερα η εικόνα θα μπορούσε να έχει αλλοιωθεί. Σημειώστε ότι η αλλαγή του σήματος μπορεί επίσης να προκληθεί από συνθήκες φωτισμού, επαναπροσδιορισμός ή συμπίεση της εικόνας χωρίς πρόθεση να αλλάξει τη σημασιολογία της. Μπορείτε να κάνετε κλικ σε κάθε φίλτρο για να το δείτε πάνω στην εικόνα που θέλετε να ελέγξετε. Στη συνέχεια, μπορείτε να χρησιμοποιήσετε το κατακόρυφο ρυθμιστικό για να συγκρίνετε την έξοδο του φίλτρου με την αρχική εικόνα.	Tutti i filtri forensi visualizzati di seguito sono finalizzati a rilevare l'alterazione del segnale dell'immagine come incoerenze in compressione, frequenze, blocchi JPEG, ecc ... Più filtri evidenziano alcune zone specifiche, più probabilmente l'immagine potrebbe essere manomessa. Si noti che l'alterazione nel segnale può anche essere attivata da condizioni di luce, ricampizzare o comprimendo l'immagine senza intenzione di modificare la sua semantica. È possibile fare clic su ciascun filtro per vederlo in cima all'immagine che si desidera controllare. È quindi possibile utilizzare il cursore verticale per confrontare l'uscita del filtro con l'immagine iniziale.	تهدف جميع فلاتر التحري المعروضة أدناه إلى اكتشاف تغييرات الإشارة في الصورة مثل التناقضات في الضغط والترددات وكتل jpeg وما إلى ذلك. كلما زاد عدد المرشحات التي تبرز منطقة معينة، زادت احتمالية تغيير الصورة. لاحظ أنه يمكن أيضًا تشغيل تغيير الإشارة من خلال ظروف الإضاءة، عن طريق إعادة تشكيل الصورة أو ضغطها مع عدم وجود نية لتغيير دلالاتها. يمكنك النقر فوق كل مرشح لرؤيته على الصورة التي تريد التحقق منها. يمكنك بعد ذلك استخدام شريط التمرير العامودي لمقارنة إخراج المرشح بالصورة الأصلية.	Alle unten angezeigten forensischen Filter zielen darauf ab, Bildsignaländerungen wie Inklohenzen bei Komprimierung, Frequenzen, JPEG -Blöcken usw. zu erkennen. Weitere Filter heben eine bestimmte Zone hervor, was wahrscheinlicher ist, dass das Bild manipuliert werden kann. Beachten Sie, dass eine Änderung des Signals auch durch Lichtbedingungen ausgelöst werden kann, wodurch das Bild ohne Absicht zur Veränderung seiner Semantik erneuert oder komprimiert wird. Sie können auf jeden Filter klicken, um ihn oben auf dem Bild anzuzeigen, das Sie überprüfen möchten. Sie können dann den vertikalen Schieberegler verwenden, um die Filterausgabe mit dem anfänglichen Bild zu vergleichen.
metadata_tip	Most social networks platforms are getting rid of metadata in pictures and videos. If, as a journalist or fact-checker, you want to ensure the picture or video is an original UGC production, ask for the original file and you can check it here as a local file to see its metadata.	La plupart des plateformes de réseaux sociaux se débarrassent des métadonnées des photos et des vidéos. Si, en tant que journaliste ou fact-checker, vous voulez vous assurer que la photo ou la vidéo est une production UGC originale, demandez le fichier original et vous pourrez le vérifier ici en tant que fichier local pour voir ses métadonnées.	La mayoría de las plataformas de redes sociales se están deshaciendo de los metadatos de las fotos y los videos. Si, como periodista o fact-checker, quiere asegurarse de que la foto o el vídeo es una producción original de UGC, pida el archivo original y puede comprobarlo aquí como un archivo local para ver sus metadatos.	Οι περισσότερες πλατφόρμες κοινωνικών δικτύων αφαιρούν τα μεταδεδομένα σε εικόνες και βίντεο. Εάν, ως δημοσιογράφος ή ελεγκτής γεγονότων, θέλετε να βεβαιωθείτε ότι η εικόνα ή το βίντεο είναι μια πρωτότυπη παραγωγή περιεχόμενου που δημιουργήθηκε από τον χρήστη, ζητήστε το αρχικό αρχείο και μπορείτε να το ελέγξετε εδώ ως τοπικό αρχείο για να δείτε τα μεταδεδομένα του.	La maggior parte delle piattaforme dei social network si sta liberando dei metadati in immagini e video. Se, come giornalista o fatti-checker, si desidera garantire che l'immagine o il video sia una produzione UGC originale, richiedi il file originale e puoi controllarlo qui come file locale per vedere i suoi metadati.	تتخلص معظم منصات الشبكات الاجتماعية من البيانات الوصفية في الصور ومقاطع الفيديو. إذا كنت، كصحفي أو مدقق معلومات، تريد التأكد من أن الصورة أو الفيديو هي إنتاج UGC الأصلي، فاطلب من الملف الأصلي ويمكنك التحقق منه هنا كملف محلي لمشاهدة بيانات التعريف الخاصة به.	Die meisten Plattformen für soziale Netzwerke werden Metadaten in Bildern und Videos los. Wenn Sie als Journalist oder Faktenprüfung sicherstellen möchten, dass das Bild oder Video eine originale UGC-Produktion ist, fragen Sie nach der Originaldatei und können es hier als lokale Datei überprüfen, um die Metadaten anzuzeigen.
twittersna_sosem_graph_tip	This socio-semantic graph measures interactions between hashtags and actors as nodes. Thickness of edges reflects the intensity of interactions. Clicking on nodes will display below the graph the corresponding tweets.	Ce graphe socio-sémantique mesure les interactions entre les hashtags et les acteurs (nœuds du graphe). L'épaisseur des arrêtes reflète l'intensité des interactions. En cliquant sur les nœuds, les tweets correspondants s'affichent sous le graphe.	Este grafo socio-semántico mide las interacciones entre los hashtags y los actores como nodos. El grosor de los enlaces refleja la intensidad de las interacciones. Al cliquear en los nodos se muestran debajo del grafo los tweets correspondientes.	Αυτό το κοινωνικο-σημασιολογικό γράφημα μετρά τις αλληλεπιδράσεις μεταξύ hashtags και actors ως κόμβους. Το πάχος των ακμών αντικατοπτρίζει την ένταση των αλληλεπιδράσεων. Κάνοντας κλικ σε κόμβους θα εμφανιστούν κάτω από το γράφημα τα αντίστοιχα tweets.	Questo grafico socio-semantico misura interazioni tra hashtags e attori come nodi. Lo spessore dei bordi riflette l'intensità delle interazioni. Cliccando sui nodi verrà visualizzato al di sotto del grafico i tweet corrispondenti.	يقيس هذا الرسم البياني الاجتماعي-الدلالي التفاعلات بين علامات التجزئة والجهات الفاعلة كعقد. سمك الحواف يعكس شدة التفاعلات. سيتم عرض النقر فوق العقد أسفل الرسم البياني للتغريدات المقابلة.	Diese sozio-semantische Grafik misst Wechselwirkungen zwischen Hashtags und Akteuren als Knoten. Die Dicke der Kanten spiegelt die Intensität der Wechselwirkungen wider. Wenn Sie auf Knoten klicken, werden unterhalb der Grafik die entsprechenden Tweets angezeigt.
twittersna_sosem_4mode_graph_tip	This socio-semantic graph measures interactions between hashtags, URLs, mentions, RTs with comment and replies as nodes. Thickness of edges reflects the intensity of interactions. Click on any node to get the corresponding tweets.	Ce graphe socio-sémantique mesure les interactions entre les hashtags, URLs, les mentions, les RTs avec commentaire et les réponses. L'épaisseur des arrêtes reflète l'intensité des interactions. En cliquant sur les nœuds, les tweets correspondants s'affichent sous le graphe.	Este grafo socio-semántico mide las interacciones entre los hashtags, URLs, las menciones, los RTs con comentario y las respuestas. El grosor de los enlaces refleja la intensidad de las interacciones. Al cliquear en cualquier nodo se muestra debajo del grafo los tweets correspondientes.	Αυτό το κοινωνικο-σημασιολογικό γράφημα μετρά τις αλληλεπιδράσεις μεταξύ hashtag, URLs, αναφορών, RT με σχόλια και απαντήσεις ως κόμβους. Το πάχος των ακμών αντικατοπτρίζει την ένταση των αλληλεπιδράσεων. Κάντε κλικ σε οποιονδήποτε κόμβο για να λάβετε τα αντίστοιχα tweets.	Questo grafico socio-semantico misura le interazioni tra hashtags, URL, menzioni, RTS con commenti e risposte come nodi. Lo spessore dei bordi riflette l'intensità delle interazioni. Fare clic su qualsiasi nodo per ottenere i tweet corrispondenti.	يقيس هذا الرسم البياني الاجتماعي - الدلالي التفاعلات بين الوسوم (هاشتاغ) وعنوان عناوين URL وComply وRTs مع التعليق والردود على العقد (الخانة). سمك الحواف يعكس شدة التفاعلات. انقر على أي عقدة للحصول على التغريدات المقابلة.	Dieses sozio-semantische Graph misst die Interaktionen zwischen Hashtags, URLs, Erwähnungen, RTs mit Kommentaren und Antworten als Knoten. Die Dicke der Kanten spiegelt die Intensität der Wechselwirkungen wider. Klicken Sie auf einen beliebigen Knoten, um die entsprechenden Tweets zu erhalten.
twittersna_acd_ts_tip	Stacked histogram of creation date of the accounts retrieved from your query	Histogramme empilé des dates de création des comptes récupérés dans votre requête	Histograma apilado de las fechas de creación de las cuentas recuperadas con su búsqueda	Ιστογράμματος σε μορφή στοίβας των ημερομηνιών δημιουργίας των λογαριασμών που ανακτήθηκαν από το ερώτημά σας	Istogramma impilato della data di creazione dei conti recuperati dalla tua query	رسم بياني مكدس لتاريخ إنشاء الحسابات التي تم استردادها من استعلامك	Gestapeltes Histogramm des Erstellungsdatums der aus Ihrer Abfrage abgerufenen Konten
twittersna_bubble_chart_tip	This graphic displays the most active accounts with their creation date (x axis) and their number of followers (y axis). The size of the nodes reflects their level of activity on your query. The rhombus shape means verified accounts. Colors show account activity on your query (Blue: less than 5 tweets per day; Orange: between 5 and 14 tweets per day; Red: beyond 15 tweets per day).	Ce graphique affiche les comptes les plus actifs avec leur date de création (axe x) et leur nombre de followers (axe y). La taille des nœuds reflète leur niveau d'activité sur votre requête. Les noeuds en losange sont les comptes vérifiés. Les couleurs montrent l'activité des comptes (Bleu: moins de 5 tweets par jour; Orange: entre 5 et 14 tweets par jour; Rouge: 15 ou plus tweets par jour).	Este gráfico muestra las cuentas más activas con su fecha de creación (eje x) y su número de seguidores (eje y). El tamaño de los nodos refleja su nivel de actividad en su consulta. Los nodos en rombos son cuentas verificadas. Los colores muestran la actividad de las cuentas (Azul: menos de 5 tweets por dia; Naranja: entre 5 y 14 tweets por dia; Rojo: 15 o más tweets por dia).	Αυτό το γραφικό εμφανίζει τους πιο ενεργούς λογαριασμούς με την ημερομηνία δημιουργίας τους (άξονας x) και τον αριθμό των ακολούθων τους (άξονας y). Το μέγεθος των κόμβων αντικατοπτρίζει το επίπεδο δραστηριότητάς τους στο ερώτημά σας. Οι κόμβοι στο ρόμβο είναι επαληθευμένοι λογαριασμοί. Τα χρώματα δείχνουν τη δραστηριότητα του λογαριασμού στο ερώτημά σας (Μπλε: λιγότερα από 5 tweets την ημέρα; Πορτοκαλί: μεταξύ 5 και 14 tweets την ημέρα; Κόκκινο: πέρα από 15 tweets την ημέρα).	Questo grafico visualizza i conti più attivi con la loro data di creazione (asse x) e il loro numero di follower (asse y). La dimensione dei nodi riflette il loro livello di attività sulla tua query. La forma del rombo significa conti verificati. Colori mostrano l'attività dell'account sulla tua query (blu: meno di 5 tweet al giorno; arancione: tra 5 e 14 tweet al giorno; rosso: oltre 15 tweets al giorno).	يعرض هذا الرسم الحسابات الأكثر نشاطًا مع تاريخ إنشائها (محور X) وعدد متابعيهم (محور Y). يعكس حجم العقد (الشريحة) مستوى نشاطها على استعلامك. شكل المعين يعني الحسابات التي تم التحقق منها. تُظهر الألوان نشاط الحساب على استعلامك (الأزرق: أقل من 5 تغريدات يوميًا؛ برتقالي: بين 5 و14 تغريدة يوميًا؛ أحمر: ما وراء 15 تغريدة يوميًا).	Diese Grafik zeigt die aktivsten Konten mit ihrem Erstellungsdatum (x -Achse) und ihrer Anzahl von Followern (Y -Achse) an. Die Größe der Knoten spiegelt ihren Aktivitätsniveau auf Ihrer Abfrage wider. Die Rhombusform bedeutet verifizierte Konten. Farben zeigen Kontoaktivitäten auf Ihrer Abfrage (Blau: Weniger als 5 Tweets pro Tag; orange: zwischen 5 und 14 Tweets pro Tag; rot: Beyond 15 Tweets pro Tag).
covid19_tip	This a customised search engine using Google CSE to query several sources of factchecks in one go. It was developed during the #EUvsVirus hackathon in April 2020	Ce moteur de recherche sur les factchecks est basé sur Google CSE. Il permet d'interroger de multiples sources en une requête. Cette fonctionnalité a été développé pendant le hackathon EUvsVirus de la Commission Européenne en avril 2020.	Este motor de busqueda se basa en Google CSE para interogar multiples chequeos en una búsqueda. Fue desarrollado durante el hackathon EUvsVirus organizado por la Comision Europea en abril 2020.	Πρόκειται για μια προσαρμοσμένη μηχανή αναζήτησης που χρησιμοποιεί το Google CSE για να ρωτήσει πολλές πηγές πληροφοριών συγχρόνως. Αναπτύχθηκε κατά τη διάρκεια του hackathon #EUvsVirus τον Απρίλιο του 2020	Questo è un motore di ricerca personalizzato che utilizza Google CSE per interrogare diverse fonti di informazioni in una crisi sanitaria Covid-19. È stato sviluppato durante la Hackathon #euvsvirus nell'aprile del 2020	هذا محرك بحث مخصص يستخدم Google CSE للاستعلام عن عدة مصادر للتحقق من صحة الأخبار دفعة واحدة. تم تطويره خلال #EUvsVirus hackathon في أبريل 2020	Dies ist eine benutzerdefinierte Suchmaschine, die Google CSE verwendet, um mehrere Quellen von Faktenchecks auf einmal abzufragen. Es wurde während des #euvsvirus Hackathon im April 2020 entwickelt
xnetwork_tip	This customised search engine uses Google CSE to perform cross-network searches on keywords. It may help to evaluate the virality of a disinformation campaign accross several platforms indexed by Google.	Ce moteur de recherche personnalisé utilise Google CSE pour interroger plusieurs plateformes à la fois. Il peut permettre d'évaluer la viralité d'une campagne de désinformation à travers plusieurs réseaux sociaux indexés par Google.	Este motor de busqueda usa Google CSE para interogar varias plataformas a la vez. Puede ayudar a evaluar la viralidad de una campana de desinformacion a traves de varias redes sociales.	Αυτή η προσαρμοσμένη μηχανή αναζήτησης χρησιμοποιεί το Google CSE για την πραγματοποίηση αναζητήσεων μεταξύ δικτύων με λέξεις-κλειδιά. Μπορεί να σας βοηθήσει να αξιολογήσετε τη βιωσιμότητα μιας καμπάνιας παραπληροφόρησης σε διάφορες πλατφόρμες που ευρετηριάζονται από την Google.	Questo motore di ricerca personalizzato utilizza Google CSE per eseguire ricerche cross-network sulle parole chiave. Può aiutare a valutare la vitalità di una campagna di disinformazione accrossisce diverse piattaforme indicizzate da Google.	يستخدم محرك البحث المخصص هذا Google CSE لإجراء عمليات بحث عبر الشبكة على الكلمات الرئيسية. قد يساعد ذلك في تقييم حملة التضليل على العديد من المنصات التي فهرستها Google.	Diese benutzerdefinierte Suchmaschine verwendet Google CSE, um eine gesetzliche Suchanfragen auf Schlüsselwörtern durchzuführen. Es kann dazu beitragen, die Viralität einer Desinformationskampagne zu bewerten, die mehrere von Google indizierte Plattformen festhält.
twittersna_explication	This feature is not aimed for making large queries but to analyse emergence of disinformation. If you need to expand or relaunch your query, erase your previous results with the right orange-background cross, and submit again with your new parameters.	Cette fonctionnalité n'est pas prévue pour de larges requêtes mais pour analyser l'émergence de désinformation. Si vous souhaitez élargir votre recherche, commencez par supprimer votre précédente requête en utilisant le bouton ad hoc (la croix blanche sur fond orange), puis relancez votre requête avec les nouveaux paramètres.	Esta herramienta permite analizar la emergencia  de desinformacion. No esta prevista para grandes busquedas. Si necesita ampliar o hacer otra busqueda, comience por suprimir los resultatos anteriores con el boton en forma de cruz con fondo naranja, y vuelva a repitir su consulta con otros parametros.	Αυτή η δυνατότητα δεν έχει ως στόχο να κάνει μεγάλα ερωτήματα αλλά να αναλύσει την εμφάνιση παραπληροφόρησης. Εάν πρέπει να αναπτύξετε ή να επανεκκινήσετε το ερώτημά σας, διαγράψτε τα προηγούμενα αποτελέσματά σας με το σωστό σταυρό πορτοκαλί φόντο και υποβάλετε ξανά τις νέες παραμέτρους.	Questa funzione non è finalizzata a fare domande grandi ma analizzare l'emergenza della disinformazione. Se è necessario espandere o rilanciare la tua query, cancella i tuoi risultati precedenti con il cross arancione destro, e invia di nuovo con i tuoi nuovi parametri.	هذه الميزة لا تهدف إلى إجراء استفسارات كبيرة ولكن لتحليل ظهور معلومات مضللة. إذا كنت بحاجة إلى توسيع أو إعادة تشغيل استعلامك، قم بمسح نتائجك السابقة مع الصليب البرتقالي الأيمن، والتقديم مرة أخرى مع المعلمات الجديدة.	Diese Funktion zielt nicht darauf ab, große Fragen zu machen, sondern die Entstehung von Desinformation zu analysieren. Wenn Sie Ihre Abfrage erweitern oder neu starten müssen, löschen Sie Ihre vorherigen Ergebnisse mit dem richtigen Orangen-Background-Kreuz und senden Sie erneut Ihre neuen Parameter.
ocr_tip	This service works best with images with text in Latin script. If you have entered a URL and it has failed to extract the relevant text, you can right use the buttons below to send the image to Bing or Yandex. Both offer OCR service.	Cet outil fonctionne sur des images avec du texte en alphabet latin. Si vous utilisez une URL et qu'il ne fonctionne pas, vous pouvez envoyer l'image à Bing ou Yandex en utilisant les boutons ci-dessous.	Esta herramienta funciona con imágenes con texto en alfabeto latino. Si usa una URL y no functiona, puede mandar la imagen a Bing o Yandex que ofrecen un servicio similar.	Αυτή η υπηρεσία λειτουργεί καλύτερα με εικόνες με κείμενο σε λατινικό σενάριο. Εάν έχετε εισαγάγει μια διεύθυνση URL και δεν έχει εξαγάγει το σχετικό κείμενο, μπορείτε να χρησιμοποιήσετε τα παρακάτω κουμπιά για να στείλετε την εικόνα στο Bing ή στο Yandex. Και οι δύο προσφέρουν υπηρεσία OCR.	Questo servizio funziona meglio con immagini con testo nello script latino. Se è stato inserito un URL e non è riuscito a estrarre il testo pertinente, è possibile utilizzare correttamente i pulsanti qui sotto per inviare l'immagine a Bing o Yandex. Entrambi offrono un servizio OCR.	تعمل هذه الخدمة بشكل أفضل مع الصور مع نص في البرنامج النصي اللاتيني. إذا كنت قد أدخلت عنوان URL وفشلت في استخراج النص ذي الصلة، فيمكنك استخدام الأزرار أدناه لإرسال الصورة إلى Bing أو Yandex. كلاهما يقدم خدمة OCR.	Dieser Dienst funktioniert am besten mit Bildern mit Text im lateinischen Skript. Wenn Sie eine URL eingegeben haben und sie den entsprechenden Text nicht extrahiert hat, können Sie die folgenden Schaltflächen rechts verwenden, um das Bild an Bing oder Yandex zu senden. Beide bieten einen Texterkennung-Service an.
